{
  "seed": 2207,
  "harmony": {
    "key": 0,
    "scale_id": "dorian",
    "progression_id": "modal_dor_01",
    "harmonic_rhythm": 1,
    "non_diatonic_budget": 0.08,
    "voice_leading_weight": 0.85,
    "cadence_strength": 0.58,
    "inversion_rate": 0.32
  },
  "arp": {
    "preset": "osc1",
    "density": 0.42,
    "note_repeats": 0,
    "on_beat": 0.54,
    "articulation": 0.56,
    "pattern_bias": 0.5,
    "morphing": 0.2
  },
  "bassline": {
    "preset": "root5",
    "density": 0.38,
    "non_roots": 0.2,
    "transitions": 0.3,
    "on_beat": 0.7,
    "pattern_bias": 0.58,
    "morphing": 0.18
  },
  "humanize": {
    "profile": "natural",
    "timing_depth": 0.24,
    "dynamics_depth": 0.38,
    "strum_time_ms": 14,
    "strum_curve": 0.12,
    "phrasing_weight": 0.72,
    "phrasing_offset": 0
  },
  "chop": {
    "preset": "eighth",
    "density": 0.18,
    "sub_cycles": 2,
    "on_beat": 0.62,
    "onset_skew": 0,
    "pattern_bias": 0.5,
    "morphing": 0.1
  },
  "mix": {
    "master_volume_db": -3,
    "ceiling_dbfs": -1,
    "lead_priority": 0.72,
    "drum_presence": 0.66,
    "bass_weight": 0.58,
    "atmosphere_width": 0.6
  },
  "transport": {
    "tempo_multiplier": 1.0
  }
}